<?xml version='1.0' encoding='UTF-8'?>
<dataset xmlns:xsi="http://www.w3.org/2001/XMLSchema-instance" xsi:noNamespaceSchemaLocation="db_test_data/xsd/dataset.xsd">

	<cd_detection_variable id="1" detection_variable_type="OVL" derived_detection_variable_id="2"/>
	<cd_detection_variable id="2" detection_variable_type="GFG" detection_variable_name="GFG name" />
	<cd_detection_variable id="3" detection_variable_type="GFG"/>
	<cd_detection_variable id="4" detection_variable_type="GFG"/>
	<cd_detection_variable id="5" detection_variable_type="GEF"/>
	<cd_detection_variable id="6" detection_variable_type="GEF"/>
	<cd_detection_variable id="7" detection_variable_type="GEF"/>
	
	<cd_detection_variable_type detection_variable_type="OVL" />
	<cd_detection_variable_type detection_variable_type="GFG" />
	<cd_detection_variable_type detection_variable_type="GEF" />
	
	<geriatric_factor_value id="1" gef_type_id="1" user_in_role_id="1"/>
	<geriatric_factor_value id="2" gef_type_id="2" user_in_role_id="1"/>
	<geriatric_factor_value id="3" gef_type_id="3" user_in_role_id="1"/>
	<geriatric_factor_value id="4" gef_type_id="4" user_in_role_id="1"/>
	<geriatric_factor_value id="5" gef_type_id="5" user_in_role_id="1"/>
	<geriatric_factor_value id="6" gef_type_id="6" user_in_role_id="1"/>
	<geriatric_factor_value id="7" gef_type_id="7" user_in_role_id="1"/>
	<geriatric_factor_value id="8" gef_type_id="1" user_in_role_id="1"/>
	<geriatric_factor_value id="9" gef_type_id="1" user_in_role_id="1"/>
	
	<user_in_role id="1" user_in_system_id="1"/>
	
	<user_in_system id="1" username="ivica"/>
     
</dataset>