<?xml version='1.0' encoding='UTF-8'?>
<dataset xmlns:xsi="http://www.w3.org/2001/XMLSchema-instance" xsi:noNamespaceSchemaLocation="db_test_data/xsd/dataset.xsd">

    <geriatric_factor_value id="1" gef_value="5" time_interval_id="1" user_in_role_id="1" gef_type_id="2" />
    <geriatric_factor_value id="2" gef_value="3.9" time_interval_id="2" user_in_role_id="1" gef_type_id="3" />
    <geriatric_factor_value id="3" gef_value="3.3" time_interval_id="3" user_in_role_id="1" gef_type_id="4" />
    <geriatric_factor_value id="4" gef_value="2.5" time_interval_id="4" user_in_role_id="1" gef_type_id="5" />
    <geriatric_factor_value id="5" gef_value="3.9" time_interval_id="5" user_in_role_id="1" gef_type_id="6" />
    <geriatric_factor_value id="6" gef_value="4.1" time_interval_id="1" user_in_role_id="1" gef_type_id="2" />
    <geriatric_factor_value id="7" gef_value="3" time_interval_id="2" user_in_role_id="1" gef_type_id="3" />
    <geriatric_factor_value id="8" gef_value="3.1" time_interval_id="3" user_in_role_id="1" gef_type_id="4" />
    <geriatric_factor_value id="9" gef_value="3" time_interval_id="4" user_in_role_id="1" gef_type_id="5" />
    <geriatric_factor_value id="10" gef_value="2.8" time_interval_id="5" user_in_role_id="1" gef_type_id="6" />
    <geriatric_factor_value id="11" gef_value="5" time_interval_id="1" user_in_role_id="1" gef_type_id="2" />
    <geriatric_factor_value id="12" gef_value="3.9" time_interval_id="2" user_in_role_id="1" gef_type_id="3" />
    <geriatric_factor_value id="13" gef_value="3.3" time_interval_id="3" user_in_role_id="1" gef_type_id="4" />
    <geriatric_factor_value id="14" gef_value="2.5" time_interval_id="4" user_in_role_id="1" gef_type_id="5" />
    <geriatric_factor_value id="15" gef_value="3.9" time_interval_id="5" user_in_role_id="1" gef_type_id="6" />
    <geriatric_factor_value id="16" gef_value="4.1" time_interval_id="1" user_in_role_id="1" gef_type_id="2" />
    <geriatric_factor_value id="17" gef_value="3" time_interval_id="2" user_in_role_id="1" gef_type_id="3" />
    <geriatric_factor_value id="18" gef_value="3.1" time_interval_id="3" user_in_role_id="1" gef_type_id="4" />
    <geriatric_factor_value id="19" gef_value="3" time_interval_id="4" user_in_role_id="1" gef_type_id="5" />
    <geriatric_factor_value id="20" gef_value="2.8" time_interval_id="5" user_in_role_id="1" gef_type_id="6" />
    <geriatric_factor_value id="21" gef_value="5" time_interval_id="1" user_in_role_id="1" gef_type_id="2" />
    <geriatric_factor_value id="22" gef_value="3.9" time_interval_id="2" user_in_role_id="1" gef_type_id="3" />
    <geriatric_factor_value id="23" gef_value="3.3" time_interval_id="3" user_in_role_id="1" gef_type_id="4" />
    <geriatric_factor_value id="24" gef_value="2.5" time_interval_id="4" user_in_role_id="1" gef_type_id="5" />
    <geriatric_factor_value id="25" gef_value="3.9" time_interval_id="5" user_in_role_id="1" gef_type_id="6" />
    <geriatric_factor_value id="26" gef_value="4.1" time_interval_id="1" user_in_role_id="1" gef_type_id="2" />
    <geriatric_factor_value id="27" gef_value="3" time_interval_id="2" user_in_role_id="1" gef_type_id="3" />
    <geriatric_factor_value id="28" gef_value="3.1" time_interval_id="3" user_in_role_id="1" gef_type_id="4" />
    <geriatric_factor_value id="29" gef_value="3" time_interval_id="4" user_in_role_id="1" gef_type_id="5" />
    <geriatric_factor_value id="30" gef_value="2.8" time_interval_id="5" user_in_role_id="1" gef_type_id="6" />
    
    <time_interval id="1" interval_start="2016-01-01 00:00:00" interval_end="2016-02-01 00:00:00" typical_period="1" />
    <time_interval id="2" interval_start="2016-02-01 00:00:00" interval_end="2016-03-01 00:00:00" typical_period="1" />
    <time_interval id="3" interval_start="2016-03-01 00:00:00" interval_end="2016-04-01 00:00:00" typical_period="1" />
    <time_interval id="4" interval_start="2016-04-01 00:00:00" interval_end="2016-05-01 00:00:00" typical_period="1" />
    <time_interval id="5" interval_start="2016-05-01 00:00:00" interval_end="2016-06-01 00:00:00" typical_period="1" />
    
    <cd_typical_period typical_period="1" period_description="month" />
    
    <cd_detection_variable id="1" detection_variable_name="Motility" detection_variable_type="GEF" />
    <cd_detection_variable id="2" detection_variable_name="Walking" detection_variable_type="GES" derived_detection_variable_id="1"  />
    <cd_detection_variable id="3" detection_variable_name="Climbing stairs" detection_variable_type="GES" derived_detection_variable_id="1" />
    <cd_detection_variable id="4" detection_variable_name="Still/Moving" detection_variable_type="GES" derived_detection_variable_id="1" />
    <cd_detection_variable id="5" detection_variable_name="Moving across rooms" detection_variable_type="GES" derived_detection_variable_id="1" />
    <cd_detection_variable id="6" detection_variable_name="Gait balance" detection_variable_type="GES" derived_detection_variable_id="1" />
    
    <cd_pilot_detection_variable pilot_id="1" detection_variable_id="2" detection_variable_description_formula="Desc 1" />
    <cd_pilot_detection_variable pilot_id="1" detection_variable_id="3" detection_variable_description_formula="Desc 2" />
    <cd_pilot_detection_variable pilot_id="1" detection_variable_id="4" detection_variable_description_formula="Desc 3" />
    <cd_pilot_detection_variable pilot_id="1" detection_variable_id="5" detection_variable_description_formula="Desc 4" />
    <cd_pilot_detection_variable pilot_id="1" detection_variable_id="6" detection_variable_description_formula="Desc 5" />
    
    <pilot id="1" name="Test" population_size="500" />
    
    <assessment id="1" />
    <assessment id="2" />
    <assessment id="3" />
    <assessment id="4" />
    <assessment id="5" />
    
    <assessed_gef_value_set assessment_id="1" gef_value_id="1" />
    <assessed_gef_value_set assessment_id="2" gef_value_id="1" />
    <assessed_gef_value_set assessment_id="2" gef_value_id="2" />
    <assessed_gef_value_set assessment_id="2" gef_value_id="3" />
    <assessed_gef_value_set assessment_id="3" gef_value_id="3" />
    
    <assessment_audience_role assessment_id="1" role_id="1" />
    <assessment_audience_role assessment_id="1" role_id="2" />
    <assessment_audience_role assessment_id="1" role_id="3" />
    <assessment_audience_role assessment_id="2" role_id="3" />
    <assessment_audience_role assessment_id="2" role_id="4" />
    <assessment_audience_role assessment_id="3" role_id="4" />
    <assessment_audience_role assessment_id="4" role_id="4" />
    
    <user_in_role id="1" />
    <user_in_role id="2" />
    <user_in_role id="3" />
    
</dataset>