<?xml version='1.0' encoding='UTF-8'?>
<dataset xmlns:xsi="http://www.w3.org/2001/XMLSchema-instance" xsi:noNamespaceSchemaLocation="db_test_data/xsd/dataset.xsd">

    <geriatric_factor_value id="1" gef_value="5" user_in_role_id="1" />
    <geriatric_factor_value id="2" gef_value="3.9" user_in_role_id="1" />
    <geriatric_factor_value id="7" gef_value="3" user_in_role_id="1" />
 
    <assessment id="184" author_id="1" />
    <assessment id="185" author_id="2" />
    <assessment id="187" author_id="1" />
    <assessment id="191" author_id="1" />
    
    <assessment id="196" author_id="2" />
    
    <assessment id="190" author_id="2" />
    
    <assessed_gef_value_set assessment_id="184" gef_value_id="1" />
    <assessed_gef_value_set assessment_id="185" gef_value_id="1" />
    <assessed_gef_value_set assessment_id="187" gef_value_id="1" />
    <assessed_gef_value_set assessment_id="191" gef_value_id="1" />
    <assessed_gef_value_set assessment_id="184" gef_value_id="2" />
    <assessed_gef_value_set assessment_id="185" gef_value_id="2" />
    <assessed_gef_value_set assessment_id="187" gef_value_id="2" />
    <assessed_gef_value_set assessment_id="191" gef_value_id="2" />
    
    <assessed_gef_value_set assessment_id="196" gef_value_id="1" />
    <assessed_gef_value_set assessment_id="196" gef_value_id="2" />
    
    <assessed_gef_value_set assessment_id="190" gef_value_id="7" />
    
    <assessment_audience_role assessment_id="184" role_id="1" />
    <assessment_audience_role assessment_id="184" role_id="2" />
    <assessment_audience_role assessment_id="185" role_id="1" />
    <assessment_audience_role assessment_id="185" role_id="2" />
    <assessment_audience_role assessment_id="187" role_id="1" />
    <assessment_audience_role assessment_id="187" role_id="2" />
    <assessment_audience_role assessment_id="191" role_id="1" />
    <assessment_audience_role assessment_id="191" role_id="2" />
    
    <assessment_audience_role assessment_id="196" role_id="1" />
    <assessment_audience_role assessment_id="196" role_id="2" />
    
    <assessment_audience_role assessment_id="190" role_id="7" />
    
    <cd_role id="1" />
    <cd_role id="2" />
    <cd_role id="7" />
    
    <user_in_role id="1" user_in_system_id="1" />
    <user_in_role id="2" user_in_system_id="2" />
    <user_in_role id="7" user_in_system_id="3" />
    
    <user_in_system id="1" />
    <user_in_system id="2" />
    <user_in_system id="3" />
    
</dataset>